<xs:schema xmlns="http://www.likyateknoloji.com/XML_agent_types" xmlns:dat="http://www.likyateknoloji.com/XML_data_types" xmlns:lt="http://www.likyateknoloji.com/XML_common_types" xmlns:par="http://www.likyateknoloji.com/XML_parameters_types" xmlns:res="http://www.likyateknoloji.com/resource-extension-defs" xmlns:state-types="http://www.likyateknoloji.com/state-types" xmlns:jsdl="http://schemas.ggf.org/jsdl/2005/11/jsdl" xmlns:xs="http://www.w3.org/2001/XMLSchema" targetNamespace="http://www.likyateknoloji.com/XML_agent_types" elementFormDefault="qualified">
    <xs:import namespace="http://www.likyateknoloji.com/XML_common_types" schemaLocation="tlosSWOrtak_v_1_0.xsd"/>
    <xs:import namespace="http://www.likyateknoloji.com/XML_data_types" schemaLocation="tlosSWData_v_1_0.xsd"/>
    <xs:import namespace="http://schemas.ggf.org/jsdl/2005/11/jsdl" schemaLocation="jsdl.2005_11.xsd"/>
    <xs:import namespace="http://www.likyateknoloji.com/state-types" schemaLocation="tlosSWState_v_1_0.xsd"/>
    <xs:import namespace="http://www.likyateknoloji.com/XML_parameters_types" schemaLocation="tlosSWParameters_v_1_0.xsd"/>
    <xs:import namespace="http://www.likyateknoloji.com/resource-extension-defs" schemaLocation="tlosSW-resource-extension-defs.xsd"/>
    
    <xs:element name="TxMessageTypeEnumeration">
        <xs:simpleType>
            <xs:restriction base="xs:string">
                <xs:enumeration value="JOB"/>
                <xs:enumeration value="SCENARIO"/>
                <xs:enumeration value="JOB_STATE"/>
                <xs:enumeration value="SCENARIO_STATE"/>
                <xs:enumeration value="RESULT"/>
                <xs:enumeration value="AlARM"/>
                <xs:enumeration value="REPORT"/>
            </xs:restriction>
        </xs:simpleType>
    </xs:element>
    
    <xs:element name="RxMessageTypeEnumeration">
        <xs:simpleType>
            <xs:restriction base="xs:string">
                <xs:enumeration value="JOB"/>
                <xs:enumeration value="SCENARIO"/>
            </xs:restriction>
        </xs:simpleType>
    </xs:element>
    
    <xs:element name="RxMessageBodyType">
        <xs:complexType>
            <xs:choice>
                <xs:element ref="dat:jobProperties"/>
                <xs:element ref="dat:scenario"/>
            </xs:choice>
        </xs:complexType>
    </xs:element>
    <xs:element name="TxMessageBodyType">
        <xs:complexType>
            <xs:choice>
                <xs:element ref="dat:jobProperties"/>
                <xs:element ref="dat:scenario"/>
                <xs:element ref="state-types:LiveStateInfo"/>
            </xs:choice>
        </xs:complexType>
    </xs:element>
    <xs:element name="RxMessage">
        <xs:complexType>
            <xs:sequence>
                <xs:element ref="RxMessageTypeEnumeration"/>
                <xs:element ref="RxMessageBodyType"/>
            </xs:sequence>
            <xs:attribute name="id" use="required">
                <xs:simpleType>
                    <xs:restriction base="xs:string"/>
                </xs:simpleType>
            </xs:attribute>
        </xs:complexType>
    </xs:element>
    <xs:element name="TxMessage">
        <xs:complexType>
            <xs:sequence>
                <xs:element ref="TxMessageTypeEnumeration"/>
                <xs:element ref="TxMessageBodyType"/>
            </xs:sequence>
            <xs:attribute name="id" use="required">
                <xs:simpleType>
                    <xs:restriction base="xs:string"/>
                </xs:simpleType>
            </xs:attribute>
        </xs:complexType>
    </xs:element>

	<!--========================================================================-->
	<!-- COMPLEX TYPES : SWAgent related types -->
    <xs:element name="SWAgents">
        <xs:complexType>
            <xs:sequence>
                <xs:element ref="SWAgent" minOccurs="0" maxOccurs="unbounded"/>
            </xs:sequence>
        </xs:complexType>
    </xs:element>
    <xs:element name="SWAgent">
        <xs:complexType>
            <xs:sequence>
                <xs:element ref="res:Resource"/>
                <xs:element ref="osType"/>
                <xs:element ref="agentType"/>
                <xs:element ref="nrpePort" minOccurs="0"/>
                <xs:element ref="jmxTlsPort"/>
                <xs:element ref="jmxUser"/>
                <xs:element ref="jmxPassword"/>
                <xs:element ref="inJmxAvailable"/>
                <xs:element ref="outJmxAvailable"/>
                <xs:element ref="jmxAvailable"/>
                <xs:element ref="userStopRequest"/>
                <xs:element ref="nrpeAvailable"/>
                <xs:element ref="lastHeartBeatTime"/>
                <xs:element ref="durationForUnavailability"/>
                <xs:element ref="lastJobTransfer"/>
                <xs:element ref="isPermitted"/>
                <xs:element ref="jobTransferFailureTime"/>
                <xs:element ref="workspacePath"/>
                <xs:element ref="locals" minOccurs="0"/>
            </xs:sequence>
            <xs:attribute name="id" use="required">
                <xs:simpleType>
                    <xs:restriction base="xs:int"/>
                </xs:simpleType>
            </xs:attribute>
        </xs:complexType>
    </xs:element>
    
    <xs:element name="workspacePath" type="lt:dirType" />

    <xs:element name="ipAddress" type="lt:ipAddressType" />

    <xs:element name="osType">
        <xs:simpleType>
            <xs:restriction base="jsdl:OperatingSystemTypeEnumeration"/>
        </xs:simpleType>
    </xs:element>
    
    <xs:element name="agentType">
        <xs:simpleType>
            <xs:restriction base="xs:string">
                <xs:enumeration value="agent"/>
                <xs:enumeration value="server"/>
            </xs:restriction>
        </xs:simpleType>
    </xs:element>
    
    <xs:element name="inJmxAvailable" type="xs:boolean" default="true"/>
    <xs:element name="outJmxAvailable" type="xs:boolean" default="true"/>
    <xs:element name="jmxAvailable" type="xs:boolean" default="true"/>
    <xs:element name="userStopRequest">
        <xs:simpleType>
            <xs:restriction base="xs:string">
                <xs:enumeration value="null"/>
                <xs:enumeration value="normal"/>
                <xs:enumeration value="forced"/>
            </xs:restriction>
        </xs:simpleType>
    </xs:element>
    
    <xs:element name="nrpeAvailable" type="xs:boolean" default="true"/>
    
    <xs:element name="nrpePort" type="lt:portType"/>

    <xs:element name="jmxTlsPort" type="lt:portType"/>

    <xs:element name="jmxUser" type="lt:userNameType" />
    
    <xs:element name="jmxPassword" type="lt:passwordType" />
    
    <xs:element name="lastHeartBeatTime" default="0">
        <xs:simpleType>
            <xs:restriction base="xs:long"/>
        </xs:simpleType>
    </xs:element>
    
    <xs:element name="durationForUnavailability" default="900">
        <xs:simpleType>
            <xs:restriction base="xs:int"/>
        </xs:simpleType>
    </xs:element>
    
    <xs:element name="jobTransferFailureTime" default="0">
        <xs:simpleType>
            <xs:restriction base="xs:long"/>
        </xs:simpleType>
    </xs:element>
    
    <xs:element name="lastJobTransfer" type="xs:boolean" default="true"/>
    
    <xs:element name="isPermitted" type="xs:boolean" default="true"/>    
	
    <xs:element name="locals">
        <xs:complexType>
            <xs:sequence>
                <xs:element maxOccurs="unbounded" ref="par:parameter"/>
            </xs:sequence>
        </xs:complexType>
    </xs:element>
    
</xs:schema>